{
  "$schema":"http://json-schema.org/draft-07/schema#","$id":"review-audit.v4.schema.json","title":"PR Review Audit - Schema v4","type":"object","required":["$schema","schemaVersion","generatedAt","sourceReport","summary","reviews"],"additionalProperties":false,
  "properties":{"$schema":{"type":"string"},"schemaVersion":{"type":"string","const":"4"},"generatedAt":{"type":"string","format":"date-time"},"period":{"type":"string"},"sourceReport":{"$ref":"review-audit.v2.schema.json#/$defs/SourceReport"},"summary":{"$ref":"review-audit.v3.schema.json#/$defs/AuditSummary"},"reviews":{"type":"array","items":{"$ref":"#/$defs/AuditReview"}}},
  "$defs":{"AuditReview":{"type":"object","required":["id","prNumber","prTitle","repository","workspace","repoSlug","branch","authorPresent","reviewedAt","timeToReviewMs","accuracyRating","result","hats","findingCount","tokensUsed","estimatedCostUsd","aicCreditsUsed","model","provider","modelsUsedCount","modelsUsed","jiraTicketKey","downstreamImpact","diffGrounding","feedback","improvementSignals"],"additionalProperties":false,"properties":{"id":{"type":"string"},"prNumber":{"type":"integer","minimum":0},"prTitle":{"type":"string"},"repository":{"type":"string"},"workspace":{"type":["string","null"]},"repoSlug":{"type":["string","null"]},"branch":{"type":["string","null"]},"authorPresent":{"type":"boolean"},"reviewedAt":{"type":["string","null"],"format":"date-time"},"timeToReviewMs":{"type":"integer","minimum":0},"accuracyRating":{"type":"number","minimum":0},"result":{"$ref":"review-audit.v2.schema.json#/$defs/AuditReview/properties/result"},"hats":{"type":"array","items":{"type":"string"}},"findingCount":{"type":"integer","minimum":0},"tokensUsed":{"type":["integer","null"],"minimum":0},"estimatedCostUsd":{"type":["number","null"],"minimum":0},"aicCreditsUsed":{"type":["number","null"],"exclusiveMinimum":0},"model":{"type":["string","null"]},"provider":{"type":["string","null"]},"modelsUsedCount":{"type":"integer","minimum":0},"modelsUsed":{"type":"array","items":{"$ref":"review-audit.v2.schema.json#/$defs/ModelUsageEntry"}},"jiraTicketKey":{"type":["string","null"]},"downstreamImpact":{"type":["object","null"]},"diffGrounding":{"anyOf":[{"$ref":"pr-review.v7.schema.json#/$defs/DiffGroundingSummary"},{"type":"null"}]},"feedback":{"$ref":"review-audit.v2.schema.json#/$defs/FeedbackSummary"},"improvementSignals":{"$ref":"review-audit.v2.schema.json#/$defs/ImprovementSignals"}}}}
}
